source,text,label
33,"es ließ sich auch zur beßerung bey ihr an, doch hatte es nicht lange bestand, so daß sie d: 12. Feb. dieses Jahrs die Krankenstube bezog,",negative
33,ich reißte auch mit meiner l. Mutter 1755 im Nov. auf einen besuch nach Bethl.,neutral
32,"Am 29n. Merz, als am Grünendonnerstag, wurde Sie in aller früh mit heftiger Beklemmung auf der Brust befallen, u. es ließ sich gar balde merken, daß der Liebhaber ihrer Seelen, mit ihrer Vollendung eile.",negative
3,"Auch besuchten ihn zu verschiedenen Zeiten von Litiz die Brüder {NAME}, {NAME} und {NAME} und lezterer reichte ihm den 11ten Juny das heilige Abendmahl unter einer seligen Gnadenbewegung, und übergab ihn seinen Schöpfer und Heiland.",neutral
14,"Er ruhet nun von seiner mühseligen Wallfahrt durch diese Zeit, die 80 Jahr und 19 Tage gedauert hat, aus an Jesu Wunden.",positive
11,"O was für ein seliges Fest war das für mich, das erstemal in meinem Sterbens Leben an diesem Tage.",positive
26,"Mein Vater, meine Schwester und ich wie auch die übrigen am Leben gebliebenen waren von Hunger und Durst ganz verschmachtet.",negative
37,"Unsre sel: Schwester war bBey Gelegenheit, daß sie <ich> die damals in Philadelphia von Br. {NAME} gehaltene Schule besuchte, <hatte, war ich> schon in ihre <meinem> Herzen angefaßt worden; u. nun besuchte sie <ich> fleißig in Bethlehem; wodurch in ihr <mir> das Verlangen erregt wurde, und immer stärker wurde, ganz dahin zu ziehen; welches sie ihrer <ich meiner> Mutter sagte., welches sie <Sie wies mich> aber mit der Antwort abortiert: Sie werden dich nicht annehmen.",positive
27,"Nun erwiderte ich: “So urteilt auch nicht, sondern gehet, sehet und höret; ich will es auch tun.”",neutral
26,"Nun zog er zu seinen Kindern Geschwister {NAME}, wo es ihm besonders gemütlich war, daß seine Tochter {NAME} ihn so, wie ihre selige Mutter, bis an sein Ende pflegen konnte, welches sie auch nebst ihrem lieben Mann mit kindlicher Liebe und vielem Vergnügen tat, wofür er ihnen reichen Gnadenlohn vom Heiland wünschte.",positive
26,"es wurde daher resolviert, daß Bruder {NAME} und ich diesen Posten für die Zeit besorgen sollten.",neutral
26,"Durch ein schleunig gebrauchtes Mittel wurde die Hitze wohl herausgezogen, aber durch nachherige Vernachlässigung wurde mein Bein so schlimm, daß meinem Vater Angst und bange wurde;",negative
23,"ich gab alle meine Anschläge auf und bat den Heiland und die Brüder mich nur in der Gemeine zu lassen, konnte aber lange keine Erlaubniß erhalten und kam endlich nach Lindheim als Schreiner zu arbeiten.",negative
20,"wir gingen die selbe ganße nacht in grossem Schnee 4 deusche Meillen, all wo wir folgenden dags in Kößnitz ein traffen",neutral
15,"sie dienten dem Herrn und der Gemeine im Ehe-Chor als Land-Arbeiter und in der Gemeinschaftlichen Oeconomie treulich und von Herzen bis sie 1756. von Litiz, wo sie 10. Monathe waren, nach der Wachau abreisen, wo sie am 12ten September a.e. ankamen, da waren sie die Ehe-Chor-Arbeiter in Bethabara und Bethanien und sie nahm sich der Schwestern sehr treu an und war von ihnen herzlich geliebt und als eine Mutter geehrt.",positive
9,Der liebe Heiland wolle ferner viele Seelen zu seinem sauren Schmerzenslohne samlen.,negative
32,"Ihr Wohlseyn lag ihr nahe am Herzen, u. gar manchen Seufzer u. stilles Thränelein weinte Sie ihretwegen zu Jesu Füßen, u. Er, der kein Seufzerlein vergißet, kein Thränelein vermißet, wird uns auch noch, wie wir hoffen, reiche Früchte davon sehen laßen.",positive
38,So weit sie selbst.,neutral
28,"Im 2ten Jahr wollte mich mein Meister nach Madeira verkauffen für eine Pfeiffe Wein, darüber war ich sehr bekümmert, sagte es einigen Nachbarn u. fragte um ihren Rath.",negative
26,"Der Eigner der Plantage kam mir in einer kleinen Entternung entgegen; sein […] ich zu ihm, mich zu erkundigen, ob ich nicht ein Canoe zum hernberfahren bekommen könnte?",neutral
26,"der liebe Heiland bekannte sich recht freundlich dazu, und es wurde dabei jedesmal in ihm die Sehnsucht aufs neue rege, bald zu dem großen Abendmahl, das Er seinen armen Sündern droben bereitet hat, einzugehen.",positive
11,"In diesem Jahr kam ich in die Lehre zum Becker- Handwerck, und blieb bis 1733, da ich ausgelernt hatte, und auf die Wanderschaft ging, bey 2 Jahr so in der Welt herum reiste und bey einem franzlichen Becker arbeitete, bis ich mich 1735 den 6ten December von den Soldaten anwerben ließ, und unter dem Groß Herzog von Florenz etwas über 1/4tel Jahr diente.",neutral
8,"denn als er am 2 May im Begriff war nach Bethlehem in die Gelegenheiten zu gehen, überfiel ihn eine Uebligkeit;",negative
7,"Aber Sinnen und Gedancken ach! die sind so voller Wancken, das ists, wo der Fehler steckt.",negative
5,"Der Verlaß war: ""Wir bleiben ungeschieden, ich gehe zum Heiland Ihn leiblich zu sehn und ihr meine lieben Schwestern bleibt ungesehn recht veste an Ihm hangen, bis mir eins nach dem andern nachkommt.""",positive
11,"man brachte ihn bald in die Stube und zu Bette, sahe aber bald aus der Lähmung der Zunge die Kennzeichen eines Stockflußes, und sein herannahendes Ende:",negative
34,Nachruf.,neutral
26,ich machte dann auch gleich Anstalt zum Bau des meinigen.,neutral
38,Sie ist auch bald darauf selig verschieden.,positive
14,"Er behielt dabey immer etwas schüchternes und zaghaftes in seinem Herzen, und konnte über den Punckt, daß er nach erfahrener wahrer Gnade dem Heiland untreu worden, leicht bedencklich werden, und erlaubte sich als denn den Zutritt zum heiligen AbendMahl nicht.",negative
11,unterdeßen war ich ganz in Seinen Willen ergeben und es wurde bald beßer mit mir.,positive
32,"Die Versammlungen der Kinder waren mir groß u. wichtig, u. gereichten mir zu wahrem Segen für mein armes Herz.",positive
21,sein beständiges sehnen u. Verlangen war dabey: Ach wenn Er mich doch bald nehmen könnte! und so begieng er am 14ten dieses noch seinen 67ten gebtag,neutral
26,Des Captains Schwester sprach gut Englisch und war die Dolmetscherin.,positive
34,"Er bediente sich der Gelegenheit an einem Sonntag, da ich in der Niederteutschen Kirche eine (den Domine Ritzema) Predigt hörte, über den Spruch: So viel Ihn aufnahmen, denen gab er Macht Kinder-Gottes zu werden, die an seinen Nahmen gläuben.",neutral
26,"Auch in den von mir von meinem Vater anvertrauten Geschäften erfuhr ich seine gnädige Durchhilfe, und er schenkte mir, auch ohne mein Bitten, dazu die nötige Weisheit, daß ich hintennach daraus erkannte, wie sehr er Sünder liebt.",positive
1,"Sie könte es nicht mehr ausstehen, ",negative
3,daher verheirathete sich meine Mutter wieder mit {NAME}.,neutral
37,"Ich zog also in meinem 13tn Jahre nach Bethm., war kindlich froh und vergnügt, und alles war mir wichtig.",positive
26,"es hielt eine höhere Hand über mir, indem ich in meinem 22. Jahre, als die Geschwister {NAME}, {NAME}, {NAME}, und {NAME} nach Oly kamen, erweckt wurde.",positive
14,Du hast mir der armen Made mehr als eine Bitt geschenckt.,positive
19,"nach 4 Wochen, sagte mir Bruder {NAME}, ich könnte nicht da bleiben",negative
9,"Mein Vetter {NAME}, in dessen Hause ich war, fragte mich, ob ich mich mit meinem lieben Gott versöhnen wolte.",neutral
4,laß sie in deiner Nägel Maal erblicken ihre Gnadenwahl durch deine aufgespaltne Seit ihr arme /// Seele heimgeleit;,neutral
4,"Dienstag den 6/17 December 1748 nahm das Lämmlein aus Gnaden zu sich {NAME}, eine 80jährige Delaware Indianerin des alten {NAME}, auch von den weissen Leuten {NAME} genannten Delaware-Indianers Frau, welche bey Gnadenthal (auf Indianisch genannt Nolemottinung, i.e. great mountain) war gebohren worden.",neutral
37,"sie kamen <aber> balde nach Gnadenhütten, wo sich ein Theil der Ind. Gem. niedergelaßen hatte, welche sie bis zum 18. Aug. <ej.a.> bedienten, da sie sich auf erhaltenen Ruf auf die Reise abermals nach Schönbrunn zogen begaben; wo sie bis Ende May verblieben;",neutral
28,"Da ich im Hause war, wurde ich gleich drinnen verschlossen.",negative
37,"Ao. 1772 zogen sie mit der Indianer Gemeine welche in Scheschequanink u. in Friedenhütten wohnte, in Begleitung des seln Bruder {NAME} nach Languntoutenunk an der großen Beever- Creek.",neutral
19,"Da ihm seine Frau einmal sagte: lieber Mann du wirst mir doch nicht heimgehen! antwortete er: was wäre doch besser für mich du weist ich bin fertig p. und tröstete sie und da andere sich äußerten, sie wünschten daß er noch bey seiner Frau bleiben möchte. sagte er: wie der Heiland will",positive
32,"Sanftmuth, Niedrigkeit Armuth, Herzlichkeit, Ein so schön als tiefes Beugen Waren Dir vorzüglich eigen.",positive
3,Es gefiel mir hier gut und ich blieb in meinem einfältigen Umgang mit dem Heiland.,positive
5,Ihr Alter hat Sie gebracht auf 58 Jahre 3 Monate und etliche Tage.,neutral
19,ja ich dachte: nun ists aus mit mir!,negative
38,Das Zeugniß von des dasigen Predigers {NAME} und den Besuch durchreisender Geschwister von der Gemeine segnete Gott zu ihrer Erweckung.,positive
14,Das erbetene Ruhepläzgen in Bethlehem erhielt er und zog kurz vor Weihnachten 1780 hieher.,neutral
14,"Diese Gesellschaft sahe mich als einen an, der halb zu ihnen gehörte.",negative
26,"wir konnten nichts als sie mit vieler Wehmut unsrem Herrn empfehlen, da diese Seine gnädige Zulassung uns nicht klar war.",negative
23,"Den 28ten August wurde ich in die Gemeine aufgenommen. und gleich drauf mit 5 andren Brüdern nach Neusalze geschickt, wo ich den 24ten August 1747 mit der Gemeine das erstmal des Sacraments seines Leibes und Blutes theilhaftig wurde.",positive
26,O wie manche Dank- und Freudestranen habe ich meinem guten Herrn für seine Langmut und Verschonen geweint!,positive
28,"Unser seliger Bruder gieng einen seligen erbaulichen Gang in der Gemeine u. es war ihm ein wahres Vergnügen, wenn er einem armen schwarzen etwas vom Heiland sagen konnte.",positive
7,"Endlich, da ich einmal vor dem lieben Heiland auf meinen Knien in grosser Verlegenheit lag, offenbarte Er sich meinem Herzen, daß Er für mich genug gethan habe, und nur von mir verlange, daß ich es glauben möchte.",positive
26,"sie gaben mir alle recht freundschaftlich die Hand; ich arbeitete aber an einem Milchgeschirr von Rothendernholz, welches sie von mir kaufen wollten, um es als ein Eßgeschirr auf der Reise zu brauchen.",neutral
33,"er seze sein Vertrauen auf den l. Gott,",positive
14,"Ich habe da Jesu Fleisch und Blut wahrhaftig gegeßen und getruncken, fühlte eine brennende Liebe zum Heiland und Seinen Wunden, und wünschte öfters zu Ihm zu gehen.",positive
26,meine Frau ritte auch und hatte das Kind bei sich;,neutral
22,"Ein Bruder Bruder fragte Ihn darauf, ob Er wolle zum lieben Heiland gehen?",neutral
26,"Aber welch ein Gebühl durchdrang uns, als wir sahen, welch eine Begierde nach dem Worte Gottes unter der lieben braunen Schaar waltete.",positive
6,d 17ten Dec. genoß er zum leztenmal das h. AMl.,positive
23,"ich kam darüber in Noth und war sehr unruhig,",negative
3,"Diese gesegnete Unterredung und die Gnade, die mir armen Sünder da widerfuhr, trug mir was rechtes für mein Herze aus und ich werde sie in meinem Leben nicht vergessen.",positive
6,"Er war geboren den 29ten May 1714 in Nürnberg, wurde in der lutherischen Religion erzogen, u war von Jugend auf um seine Seligkeit bekümmert.",negative
14,"Denen ihn besuchenden Geschwistern bezeugte er, daß er seiner Auflösung mit ruhigem Herzen entgegen sehe.",positive
26,mit unseren Tagen gings von hier weiter.,neutral
4,"Ihr Sohn {NAME} kam in Majo anni currentis und bat die Brüder in Bethlehem, daß sie ihm und seinen Eltern möchten Erlaubniß geben bey Nazareth zu wohnen, und was vom Heiland zu hören, denn er hätte ehemahls ein Gefühl in seinem Herzen gehabt, habe es aber verlohren, und wünschte, daß er wieder Worte vom Heiland hören möchte;",negative
14,"Anno 1739 um Ostern reiste ich von Hamburg nach Amsterdam, um von da nach London und so ferner nach America zu gehen.",neutral
32,"Ich bin geb. 1748 d. 18tn Octr. in Bethlehem, u. zog noch das selbe Jahr mit meinen l. Eltern nach Nazareth u. d. 5tn. Apr. 1750 in die Nursery.",neutral
28,Das war 1741. und ich war damals etwa 12. Jahre alt.,neutral
5,"Meine Mutter war, {NAME} aus Oettingen in Schwaben; ihr Vater war als ein Knabe von 7 Jahren mit seiner Mutter um der Religion willen aus Oesterreich emigrirt, mit Verlassung ihrer Verwandten und Güter.",neutral
26,Sie sahen sich dann mein Werkzeug an;,neutral
10,"1726. wurde ich mit einigen Leuten bekannt, die erweckt waren und wurde von meinem schlechten Leben und Gang überzeugt, suchte auch mich von dem Sünden Dienst und dem spielen loszumachen,",negative
27,"Daher beschloß ich bald, zu heuraden, welches auch geschah 1737 und wurde den 23. Dezember getraut mit einer lieben {NAME}, geborene {NAME}in, die ich von Jugend auf liebhatte.",positive
15,"Sie war in allen Stücken, eine Exemplarische ehrwürdige Schwester, als Frau und Witwe, stille, friedsam, eingezogen, kindlich gebogen und an ihren ewigen Mann zärtlich attachirt.",positive
3,"weil ich aber glaubte, er könne mir nicht helfen, so sagte ich es ihm nicht.",negative
27,"Anno 1740 hörte ich, daß in der Nachbarschaft ein frommer Pfarrer sei, der viel von einem Heiland rede und verschiedene Leute bei sich habe, die sehr fromm wären.",positive
26,Er freute sich der nahen Hoffnung dazu.,positive
26,"In dieser Verlegenheit fiel ihm ein, daß er ein medizinisches Buch von seiner Mutter Schwester erhalten hatte;",neutral
9,Wir Geschwister hier haben uns lieb und der Heiland segnet unser beysammen seyn.,positive
26,es erboten sich daher 2 Indianer mich mit dem Canoe dahin zu bringen;,positive
1,"im Juny ver wichnen Jahrs kriegte Sie durch einen kalten Trunck einen Schaden auf ihrer Brust, war aber doch noch mit in der Erndte, so wohl hier in Bethlehem, als auch in Gnadenthal wurde aber zulezt so kräncklich, das sie muste nach Bethlehem gebracht werden, ehe die Erndte ganz vorbey war,",negative
19,"alle die Gnade, die ich zu haben meynte fiel weg,",negative
26,"Zu Ende Novembers ging ich nach Bethlehem, meine Frau, welche dort kränkelte, zu besuchen und abzuholen, wozu ich die Indianer {NAME} und {NAME} als Reisegefährten mitgenommen hatte.",negative
39,"allein der Gedancke, daß ich dem l. Heiland der mir meine Sünden vergeben, u. mich zu Gnaden angenommen hatte, Alles zu Liebe zu thun, schuldig bin, machte daß /// daß ich mich drin ergab.",positive
5,"Sein Leiden, auch sein Leiden, sein Bluten und sein Sterben, und daß ich armes Würmlein erlößt erworben und gewonnen bin von Sünd und Tod, mit dem kostbaren, unschuldigen Blut, das geht mir über alles in Zeit und Ewigkeit.",positive
33,"weill sich nun der Indianer ein Haus in Koskoshin baute, so wolte er mich mit dahin haben, ich wolte aber nicht sondern lieber bey meiner alten Mutter bleiben, welche näher nach Pizburg zog",neutral
32,"ja ich fand mich weit zurücke,",negative
16,"Sie war bey ihren Schmerzen und zunehmenden Engbrüstigkeit gewiß ein Exempel der Geduld und den anwesenden Geschwistern zum besondern vergnugen welche sie öfters bat, ihr Versel zu singen, und sonderlich dieses: Drüm wünsch ich mir, so lang ich hier abwesend von Ihm wolte welches auch bey gesunden Tagen ihr liebsten Versel war.",positive
26,"Bei Gelegenheit, daß meine Mutter Bruder Tochter sich bei uns aufhielt, versprachen wir einander die Ehe; dagegen setzte auf der Kniescheibe eine Geschwulst, die nach und nach zunahm und sich in der Folge aufs Schienbein herunter zog.",negative
26,"Mein Vater, der sehr aufgebracht gegen mich war, legte dennoch mehr die Schuld meiner Veränderung auf die Brüder und glaubte, daß sie mich verführt hätten.",negative
26,Er fand es für gut mich noch länger hienieden zu lassen.,positive
14,"Es kam aber nicht dazu, sondern ich ging statt deßen, weil ich die Luft in Holland nicht vertragen konnte, und die meiste Zeit das Fieber gehabt hatte, 1729 im Herbst wieder nach Altona, wo ich drittehalb Jahre blieb, und 1732 um Ostern, die Meinigen zu besuchen, nach der Schweiz reisete.",negative
5,"Allein eines Tags, da ich früh nach Gewohnheit meinen Vater aus dem neuen Testament vorlas, und zu den Worten des Heilands kam: Wer Vater oder Mutter mehr liebet denn mich, der ist mein nicht werth: wurde ich so gerührt, daß ich das Buch hinlegte, als ob ich was nothwendiges zu bestellen hätte, eilte in meine Stube und schrieb einen Brief an meinen Vater über diese Worte, declarirte ihm zugleich auf die beweglichste und submissete Weise mit vielen Thränen, daß ich den göttlichen Ruf in meinem Herzen nun nicht länger wiederstehen könne, ich würde unverzüglich mich aufmachen und fortgehen nach Herrnhaag.",negative
26,"Im Jahr 1781, als Bruder {NAME} zur Visitation hier war, kam Bruder {NAME} hieher, und nachdem er verheiratet worden war, folgten wir dem aufs neue erhaltenen Rufe, dem Heiland bei der Indianer-Mission zu dienen, und gingen aufs neue gestärkt mit Geschwistern {NAME}s am 8ten Juli auf die Reise und trafen am 28ten des Monats bei der Indianer Gemeine in Schönbrunn zu deren großen Freude ein.",positive
9,"Er lag von da an, ohne viel zu reden, bis er Morgens am 27ten gegen 8 Uhr seliglich entschlief im 78ten Jahre seines Alters. Memorabilien",positive
27,"Anno 1747 kamen wir in die Wirtschaft nach Marienborn und von da Anno 1748 wieder nach Herrnhag, wo wir bis im Oktober blieben und dann unserem erhaltenen Ruf zufolge über Holand und England nach Nordamerika reisten.",neutral
35,"dieser erstmalige Genuß, und was mein armes Herz dabey empfunden wird mir Lebenslang in unvergeßlichem Andenken bleiben.",positive
26,"Mein Vater fing eine Branntweinbrennerei an und, da dieses Jahr ein reichliches Obstjahr war, so hatten mein Vater, meine Schwester und ich genug zu tun, doch lernte ich auch daneben noch von meinem Vater das Küferhandwerk.",positive
34,"O mit was süßer Empfindung konte ich mein Haupt an das für mich mit Dornen gekröntes Haupt nieder legen, und abermal hieß es in meinem Herzen: Es ist vollbracht.",positive
26,Nun kamen wir nach Ober-Sandusky über 100 Meilen von unserem vorigen Wohnort ganz im Busch.,neutral
11,Ich bin anno 1713 den 24ten October in Hädelfingen im Würtemberglichen geboren und in der Lutherischen Religion getauft und erzogen worden.,neutral
28,(Er war der erste Neger den die Brüder in Pennsylv. taufften),neutral
33,"ihr Sohn nahm mich auch zur Schwester an,",positive
19,"da er seine Frau weinen sah, sagte er liebe Frau warum betrübst du mich, gab ihr die Hand und sagte: weine ja nicht, der Heiland wirds gut mit dir machen.",positive
18,Im Jahr 1794 zogen wir hieher nach Nazareth.,neutral
7,"Laß es meiner Seel gelingen, gib dem Wollen das Vollbringen, es ist ja dein Gnaden-Werck, das du in mir angefangen.",positive
36,"Nachdem ich wieder in die Stadt zog, hörte ich von den Brüdern, und weil {Meister} {NAME} ein Bruder war, und bey ihm sich die aus der Gemeine besuchenden Geschwister immer /// aufhielten, so hielt ich bey ihm um Dienste an, und er nahm mich ins Hauß.",neutral
26,Die Beschreibung der Hölle flößte mir aber mehr Furcht als Liebe gegen Gott ein.,negative
18,"Noch eher als man es erwartet hatte, ge- laugte sie an dieses ersehnte Ziel ihres Glau- bens; -- indem sie am folgenden Vormittag ganz unverhofft verschied.",positive
11,"Artig war auch der Umstand, da die Loosung des Tages aus dem Jahrgang von 1772 die der in Ermangelung derer für dieses Jahr ad interim erwehlt worden, aber die selbe, die anno 1748 der selige Bruder zu der Gemeine in Herrnhaag kam; Thue ein Zeichen an mir, daß mirs wohl gehe.",positive
11,"O Lamm, da bin ich in Deinem Garten, du magst selbst dein Pflänzlein warten.",neutral
36,"1752 im July reiste ich mit noch mehr ledigen Schwestern über Holland und England nach Pensylvanien, und kamen am 25ten Nov.",neutral
32,Nicht ein Seufzerlein Laß vergeßen seyn!,positive
28,Während seines Aufenthaltes wurde ich d. 15. Febr. n. St. durch Bruder {NAME} in Jesu Tod getaufft u. {NAME} genennt.,neutral
27,Ich bin den 8. Oktober 1717 zu Balkheim im Fürstentum Oettingen geboren.,neutral
26,"Nach 6 wöchentlicher Aufenthalt reiste ich im August als Begleiter des Br. {NAME}, der in Pachgatgoch besuchen wollte, wieder zurück.",neutral
34,"die Antwort meines Herzens war: Lieber Heiland, es ist deine Gerechtigkeit, damit du mich bekleidet hast, jezt kan ich glauben, daß du mein Gott und Heiland bist.",positive
3,1762 erhielt ich einen Ruf als Chorhelfer der ledigen Brüder nach Litiz und wurde den 19ten Merz dem Chor vorgestellt.,neutral
2,"Da ihr Vater sie das erstemal besuchte, sagte ihr die Schwester {NAME}in sie möchte nun mit ihm wieder nach Hause gehen, worüber sie sehr weinte:",negative
19,"Ich nahm den 12ten Anhang schlug mir einen Vers auf und kriegte den: Ach mach doch vielen Herzen, an manchen Orten bang, errege ihnen Schmerzen verfolge sie so lang, bis sie sich keinen Ausweg sehn und daß sie sich entschliessen, zur Creutz-Gemein zu gehn.",negative
5,"So ihr Husten und die große Schwäche je länger je mehr zu werden schien, so beklagte sie sich doch nicht darüber, sondern war immer dankbar, daß ihr der Heiland alles erleichterte und ihr die Zeit verkürzte;",positive
34,"Ich gab ihnen zur Antwort: Wenn wir einmal vor dem l. Heiland erscheinen würden, so würde er nicht fragen, zu welcher Kirche wir gehöret hätten, sondern ob wir in seine Blutgerechtigkeit eingekleidet worden?",positive
33,"meine Mutter Sprang ins Wasser u wurde erschoßen, u meine jüngste Schw. wurde auch gleich umgebracht",negative
27,"Kam dann endlich auf die Idee, wenn ich heuraden würde, so würde es besser gehen.",neutral
13,"Ich bat gleich den Heiland, wenn Er mich zur Gemeine berufen habe, mir seinen Willen klar zu machen, welches Er auch ohne mein weiteres Zuthun that, und ich bekam Erlaubniß hier zu bleiben.",positive
14,1721 im Früh-Jahr kam ich von Basel nach Zürch in Condition; und von da im Herbst nach Leipzig.,neutral
28,"Wer Schweinsfleisch isset, den hassen u. scheuen die anderen als einen sehr bösen Menschen.",negative
34,{NAME}.,neutral
33,"so bald ich aber wieder beßer wurde so waren mir die Geschwister behülflich daß ich nach Bethl. Kam,",positive
11,"Er besorgte dem ohngeachtet seine Geschäfte, bediente auch noch kurz vor seinem Ende die Gelegenheiten auf dem Saal, gieng am lezten Abend den 24ten January nach verrichtetem Geschäfte mit seinen Brüdern zu Bette auf dem Schlafsaal, stund gegen Morgen auf und ging die Treppe herunter;",positive
24,"Da unsern Kna-ben in Xtiansbrunn im Monat Mart. sich an den blattern legten, fing er auch an zu kränkeln u. vermuthete, daß er sie ebenfals kriegen u. bey der gelegenheit zum Heilde heim gehen werde.",negative
37,"Als nach einiger Zeit Br. {NAME} in meiner Eltern Hause besuchte, so bat ich ihnm, daß er doch ein gut Wort für mich einlegen möchte, daß ich Erlaubniß nach Bethm. Bekäme.",positive
34,nun wird dein Verlangen Ganz gestillt;,positive
26,"Nachdem wir hier 2 Jahre recht vergnügt verbracht, zogen wir im October 1772 nach Schönbrunn, 100 Meilen weiter nach Westen.",positive
5,es wird geschehen bald werd ich Jesum sehen.,neutral
27,"Zwar nicht nach meinem Willen, auch nicht meiner Freunde Willen, aber ich glaube, es war des lieben Heilands Will, denn wir hatten und behielten einander lieb. Aber mit meiner Bekehrung wollte es noch nicht gehen.",negative
11,"Die Erkenntniß und Gefühl seines Elends, und der ihm durchs Verdienst Jesu erworbene Gnade erhielt ihn gebeugt und klein, daß, ob er mal ein Gehülfe im Chor war, er sich doch als der geringste unter ihnen ansahe, und eben dieses machte ihn unter denselben nicht nur, sondern auch bey allen Geschwistern, insonderheit auch wegen seines unermüdeten Fleißes und treuen Dienstes bey der gemeinschaftlichen Oeconomie, legitimirt und beliebt.",positive
19,"Er gab allem die ihn besuchten freundlich die Hand, lag darauf stille bis er abends in der 8ten Stunde sanft und selig einschlief, im 51ten Jahr seines Alters.",positive
28,"Mein Begleiter forderte aber mehr für mich als sie geben wollten, er nahm mich deswegen wieder mit, brachte mich wieder an besagtes Revier, nahm mir da meine Kleider u. verkauffte mich an einen der in das Land hinein handelte.",negative
12,"In meines Herrn Tod und Schmerz, da ist mein Element -",negative
26,Ich wagte es daher auf die Hilfe des Heilands;,positive
7,"Am 13ten ging er nach seiner Art wohl zu Bette, stand aber bald wieder auf, und klagte, daß ihm nicht wohl sey.",negative
26,In meinem 9ten Jahre erfuhr ich eine besondere Bewahrung von meinem guten Heiland.,positive
26,Gott schenckte mir aber wieder meine Gesundheit.,positive
33,ich grigte nichts zu Eßen,negative
34,"{Ja} Sie rief oft aus, lieber Heiland kom doch, komm und hohle dein armes und voller Schmerzens kranckes Schäflein zu dir, ich bin ja dein, und will mich gerne als deine arme Sünderin unter deine Füße legen.",negative
5,"Von denen verschiedenen Perioden, die ich mit der lieben herrnhaagschen Gemeine wie in einer beständigen Uebernommenheit durchpasirte, etwas specielles zu sagen, unterstehe ich mich nicht.",negative
8,Sichem'. Pachgatgoch. nach seinen selbst eigenen mündln. Erzehlungen aufgesezt.,neutral
7,"Im December 1771. wurde ich nach Pablowizky, jezt Gnadenfeld geschickt, um dem Bruder {NAME} an die Hand zu gehn, und mich dabey der ledigen Brüder mit anzunehmen.",neutral
11,"Im August 59 wurde ich sehr kranck an Glieder-Schmerzen, und weil noch ein anderer Bruder mit mir auf die Krancken-Stube zog, so war ich verlangend zu wißen, welchen von uns beiden der Heiland erst zu sich heimküßen würde, und dieses Glück traf meinen Cameraden;",negative
14,Seine Schwachheit erlaubte ihm nicht mehr aufzustehen.,negative
