source,text,label
16,"Am lezten Tage ihres 5ten Jahres ging sie aus eigenem Trieb vor sich alleine, legte sich auf ihr Augensicht, und betete zum Heiland, und als am folgenden Tage die kleine Angelin heimgieng, und sich einige Kinder mitleidig bezeugten, sagte sie: das ist ja schön, wenn wir zum l. Heiland gehen, es ist ja das besten für uns.",positive
14,"14 Tage nach meiner Aufnahme in die Gemeine zu Bethlehem, fährt er fort, traf mich das Glück, mit dem Herrn Grafen und den ihn begleitenden Brüdern und Schwestern auf seinen ersten Heiden-Besuch unter die Delawar- Indianer zu gehen.",positive
1,"bis Abends da die Gemeine beym Abendmahl war, erblaßte Sie recht selig und sanftte in Jesu Arm und Schooß unter den Worten, blaße Lippen küßt Sie aufs Herz, mit dem segen ihres Chors im 19.ten Jahr ihres Alters.",positive
26,Ich übergab mich nun meinem Sohn {NAME} und dessen Frau {NAME} in die Pflege.,neutral
5,O wie wirds so wohl thun p. Und wer wird da wißen wie p.,neutral
13,"Es lag mir an im Aeußern vor jedermann gut zu erscheinen, und im Innern fehlte mirs noch an wahrer Sünder Gnade.",negative
4,Nachmittag um 3 Uhr kam {NAME} und seine Freunde an;,neutral
1,"{NAME} die Indianerin war von der Delawar Nation, ist Anno 1742 in Minisink geboren, ihre Mutter brachte Sie als ein Mädgen mit zum Besuch nach Gnadenhütten, und lies Sie bey ihrer großMutter der Schwester {NAME}, mit welcher Sie auch 1755 im November da die Indianer von Gnadenhütten weg flüchteten nach Bethlehem kam, blieb auch noch etliche Monat bey ihr.",neutral
3,"Anno 1748 bekam ich (durch denselben) einen Ruf nach dem Herrnhaag, wo ich den 20ten November mit Bruder {NAME} ankam und den Knaben als ihr Arbeiter vorgestellt wurde.",neutral
26,"Nach einem wehmütigen Abschied von ihnen gingen wir im Monat März mit unserem Führer, einem Englischen Off~zier, von Geburt einen Franzosen, namens {NAME}, der unsre Beschwerden sehr erleichterte, von Ober-Sandusky ab.",positive
0,"davon zeugte auch seine liebhabende, vergnügte u. friedlich gesinnte Art u. er wurde als ein wahrer Bruder von uns allen herzlich geliebt u. geehret.",positive
26,"Unser Trost aber war, wir haben einen Vater, der dem kleinsten Kreatürchen den Unterhalt nicht versagt, der wird auch für uns sorgen; und so wie die Not am größesten, war Seine Hilfe am nächsten;",positive
20,"es währde nicht lang so warde mir mein sündliches verderben klar und vor augen gestelt, bey einer gelegenheit die der selige Bruder {NAME} äben hilt.",negative
28,"Des Abends kniete ich nieder u. sagte: O Herr, unsere Nachbarn sagen, du seyst so sehr gut u. du gäbest jedermann was er von dir bittet.",positive
5,"Bis mir einmal in einer Nachtwache, deren ich zu der Zeit manche hatte, der liebe Heilige Geist den bekümmerten Schöpfer vor mein Gemüth stellte, wie Er um seine gefallene Kreatur kläglich that, ihren gräßlichen Tod bejammerte und auf einmal die große Resolution faßte Mensch zu werden:",negative
13,"Sie war vor mehreren Jahren bey der Erziehung der Kinder in der Mädgen-Anstalt angestellt, und nachher diente Sie als Kranckenwärterin im Chorhause, welche Geschäfte Sie mit vieler Angelegenheit besorgte, bis Sie selbst kräncklich wurde und davon dispensirt werden muste.",neutral
11,"mir war wegen der Unruhe meines Herzens Angst und bange, und ich starb wircklich, und als ich den lezten Othem-Zug gethan und das Leben ein Ende hat, so erwachte ich mit einem großen Geschrey, daß ich alle in meines Vaters Hauß aufweckte, und kamen zu meinem Bette, ich aber konte vor eine viertel Stunde nichts sagen;",negative
32,"ich fühlte etwas, das ich vorher noch bey keinem Abendmahl gefühlt hatte;",positive
26,"Am 22ten November 1793 gefiel es meinem guten Herrn, mich von meiner treuen und mir unvergeßlichen Gehilfen zu trennen und sie zu sich zu nehmen; ein Schmerz, den nur Er lindern konnte!",positive
26,"Ich erwiderte, daß ich es ebenfalls sehr nötig brauche.",neutral
26,"Hier gingen sie all in ein kleines Häuschen, wohin wir auch gebracht wurden;",neutral
14,"Schmerzen fühlte er nicht, nur große Schwachheit, sagte auch zu seinen lieben Hauswirthen, daß er wohl heimgehen würde; er wär auch von außen und innen dazu ganz fertig.",positive
5,"Da nun eben die selige Marterwoche eintrat und sie nicht mehr ausgehen konnte, so wünschte sie das Pedilavium zu dem Zweck in ihrer Stube zu haben.",neutral
19,Ich bin geboren den 10ten November 1728 in dem brandenburgschen Städtgen Eichen.,neutral
3,"Hier kam ich noch unter die Kinder, unter denen ich recht vergnügt war, und ging in die Tages-Anstalt.",positive
1,"als Sie die Kranckenwärterin fragte, was ihr wäre, sagte sie, Ach das Abendmahl hätte ich gerne, ich kan nicht mehr warten,",neutral
11,"Den 19ten fuhren wir von Holland ab, und kamen den 17ten im Haven von Dover an, wurden von hier nach London zum seligen Jünger gebracht, und der selge Christel sprach mich hier noch zum leztenmal.",neutral
22,Ja sagte Er.,positive
26,Seit mehreren Jahren war er ein Mitglied des hiesigen Aufseher-Collegii gewesen und konnte aus seiner langen Erfahrung oft guten Rat erteilen.,positive
12,"Sein Versgen, welches Er in der Christnacht geschenkt gekrigt, hies: O faßte sie mein Herze auf balsamsche Tröpfelein! wie Sie so recht im vollem Lauf von Ihm getröpfelt seyn.",positive
33,"nach 3 Wochen hörten wir daß die {NAME} von den Indianern verbrant worden u viele von den Geschwistern mit in der Flamme umgekommen, u daß sie auch welche ermort hätten,",negative
26,"Ich erwiderte aber: Nein, ich werde dieses Mal nicht heimgehen.",negative
14,Anno 46 waren sie meistens in Amsterdam in Besorgung der äußern Sachen der Kinder-Anstalt; Anno 47 aber kamen sie nach einigen Reisen in Teutschland den 3ten Februar nach London.,neutral
26,Von New England aus einem neuen Örtchen Pachgatgoch genannt;,neutral
33,"meine alte Mutter weinte auch sehr, und sagte zu mir ich solte es doch thun sonst würden sie mich verbrennen und den hätte sie kein Kind mehr, bey mir war es aber immer Nein,",negative
37,"Desto größer war meine Freude, da sie mir endlich sagte, daß ich Erlaubnis hätte.",positive
3,Den 23ten July reiste ich von Herrnhut ab;,neutral
25,"Die selige Schwester {NAME} unsrer Geschwister {NAME} und {NAME}s älteste Tochter war gebohren 1759 den 11ten September in Gnadenthal, und von ihrer Geburt an ein sehr schwächliches Kind.",negative
26,"In der folgenden Nacht brach sich die Krankheit, es stellte sich Appetit zum Essen ein, meine Hand fing an zu heilen und nach 6 wöchentlicher Kur war ich ganz gesund und ich konnte wieder nach Gnadenhütten gehen.",positive
32,"1779 d. 4n. Septr. Nachdem die Mädgen-Anstalt allhier, von Zeit zu Zeit immer kleiner wurde, u. die damalige Arbeiterin der Kinder, die sel. Schwester {NAME}, welche bis dahin in der Anstalt gewohnt hatte, ins Schwr. Hauß zog, wurde sie auch aus ihrem 13 Jährigen Dienst in der Anstalt entlaßen.",neutral
14,"Er verordnete auch in seinem Testament, daß wenn eine öffentliche Rede bei seinem Begräbniß gehalten würde, der Text dazu aus 1 Timotheus 1, 15 das ist ja gewißlich wahr, und ein theuer werthes Wort, daß Jesus Christus kommen ist in die Welt, die Sünder selig zu machen, unter welchen ich der vornehmste bin"" genommen werde.",positive
11,"Da mir 1756 im August eine hizige Kranckheit zustieß, dachte ich: Nun wird Er mich wol heimküßen;",negative
18,Von 7ten May 1792 trat sie mit mir in die Stand der Heil. Ehe.,neutral
26,"dabei hatte ich weder Tag noch Nacht Ruhe ich kniete oft nieder und betete,",negative
38,"In derselben hörte man sie einmal in ihrer Phantasie mit ihrem lieben Mann, als wenn sie ihn gegenwärtig hätte reden, ihn bedauern, daß er beynahe Schiffbruch erlitten, und zulezt zu ihm sagen: Ich bin aber nun nicht mehr da, wenn du komst, der Heiland hat es gethan und der wird dich darüber trösten.",neutral
3,"In meinem 10ten Jahr, wurde ich an einem Sonnabend, da der Schulmeister die Schule mit einem Gesang schloß, in meinem Herzen vom Heiligen Geist erweckt und mein elender Zustand stund mir so lebendig vor Augen, daß ich glaubte, ich müste verloren gehen.",negative
26,"Außerdem las er gern in der heiligen Schriß, die Gemeinnachrichten und andere Gemeinschriften.",positive
27,"Ich sagte oft zu den Leuden, die so Böses von ihnen sagten: Habt Ihr die Leude gesehen oder gesprochen?",negative
5,"Er redete, wie mirs vorkam, ungewöhnlich deutlich mit uns von der Neu-Geburt des Herzens, von der Keuschmachung unsrer Seele, von der Nothwendigkeit mit dem Herrn Ein Geist zu werden und von der Heiligung ohne die niemand sein Angesicht schauen kan. ",neutral
0,"Unser lieber sel. Bruder {NAME} der am 15. Nov: 1792 im Bethlm seli entschlief hat von seinem Gange durch diese Zeit nichts eigenhändiges hinterlassen, wir können daher nur folgendes wenige davon anführen.",neutral
39,"Von Bethel kammen wir nach Hebron, wo wir anderthalb Jahre (ich in fast anhaltender Kräncklichkeit) blieben; bis wir durch Geschw: {NAME}s abgelöst wurden; (u. wir wieder nach Heidelberg kamen, dort eine kurze Zeit blieben, u. dann auf eine kurze Erholungszeit weile zur Erholung nach Bethlehem kamen; wo wir nach einem Jahr den Ruf zur Bedienung des Gemeinleins in Shoenek kamen erhielten.",neutral
2,"1 Sohn und 3 Töchter, die älteste Tochter die an Bruder {NAME} verheiratet war ist zum Heiland gegangen, der Sohn ist in der Nachbarschaft verheurathet und die 2 jüngeren Töchter sind noch bey uns hier.",neutral
34,Beym Begräbniß der l. selig entschlafenen Schwester {NAME} in Emaus d. 20tn Janr 1793 ________________________________________________________________________,neutral
34,"Weil ich gewohnt war oft in Bethlehem zu besuchen, so ging ich unter den Vorwand wieder dahin, und kam den 11tn May in meinem l. Bethlehem an.",positive
37,Aus einer schriftln. Nachricht von ihrem sel. Mann ist ferner anzuführen.,neutral
26,"Hier blieben wir 4 Wochen von ihnen getrennt, ohne im mindesten (außer schlechten Gerüchten von bösen Menschen) etwas von ihnen zu hören.",negative
32,Mein Herz zerfloß für Schaam u. Beugung darüber zu meines Hlds Füßen.,positive
1,"Sie hatte, auch ver schieden malen von ihrer Mutter und ihren übrigen Freunden versuchung, sie von der Gemeine abtrünnig zu machen, und wieder mit ihnen in Busch zu ziehen,",negative
8,"hier fügte es sich nun sehr artig, daß der sele. Jünger, der damals am Dresdnischen hofe war, die untere Etage in dem hause, wo unser Seliger wohnte, zur Muethe nahm, u. in den selben seinen Domestikon tägl. Versammln hielt, in welche besonders Sonntags auch viele fremde hinein gingen, u. darunter das sele. Bruders seine Frau, die ihm oft erzehlte, was der herr Graf vor schöne Steilen hielt.",positive
26,Nicht nur seinen nächsten Freunden sondern auch allen mit ihm mehr oder weniger Bekannten flößte seine liebhabende und freundschaftliche Art Achtung ein.,positive
24,"Seine Krankheit war sehr heftig u. angreiffend, u. weil die Blattern nicht zur völligen Reife kamen, stand er dabey vieles aus.",negative
32,Er ließ mich auch nie ungetröstet.,positive
5,"Der werthe Heilige Geist hatte in diesen und folgenden Jahren sein eignes Lustspiel unter unsern lieben Kindern und bereitete unserm lieben Heiland ein mächtiges Lob, aus dem Munde dieser Unmündigen.",positive
23,er gab mir alle Freyheit und offerirte mir den Haus Schlüßel,positive
26,"So lange er noch in der Nähe des Gemeinsaals wohnte, besuchte er die Versammlungen, so oft es seine Kräfte zuließen.",neutral
26,"Als sie die Kisten ausgeleert und so das Haus ausgeplündert hatten, machten sie es aber so in Geschwister {NAME}s Haus.",negative
34,"Der Prediger kam auch selber und bezeugte sein Wehethun, weil ich seine Kirche verlaßen wolte; da er aber sahe, daß ich veste determinirt war zu den Brüdern zugehen, so sagte er, er wolte mir nicht hinderlich seyn, sondern des HErrn Segen dazu wünschen.",positive
26,Mein Vater schickte gleich zu einem 20 Meilen von uns wohnenden Doctor;,neutral
13,"Der Heiland hat unsrer seligen Schwester den Eindruck davon, daß Er sie selbst der Welt entrißen und zu Seinem Volcke gebracht hat, bis an ihr seliges Ende erhalten, und sie hat sich daran gar oft und viel mit tiefgebeugten Sünder- und Danck-Thränen erinnert.",negative
26,"Der Captain glaubte, daß sämtliche Passagiere wohlhabend wären und hatte daher nicht im Sinn uns ans Land zu bringen sondern uns alle verhungern zu lassen, welches ihm leider größten Teils gelang, indem von den 156 Personen nur 48 das amerikanische Land betraten, und es wäre keine davon gekommen, wenn die letzten nicht aufrührerisch geworden wären und den Captain in Verhaft genommen hätten, da wir dann in drei Tagen auf bei Rhode Island glücklich vor Anker kamen, welches in der Woche vor Weihnachten war, nachdem wir 25 Wochen auf der Reise verbracht hatten.",positive
19,"Ich accordirte lange mit dem lieben Heiland,",negative
26,"Sie erlaubten uns, während unseres Hierseins zu Bruder {NAME} zu ziehen.",positive
32,"Von nun an, wurde mir die Sünde, ja alles das, wozu ich bisher noch Neigung gefühlt hatte, zum Ekel, u. ich wollte gar nichts mehr damit zu thun haben; wurde aber zuweilen etwas davon wieder bey mir rege, so klagte ich es dem l. Hld. mit vielen Thränen, u. sagte Ihm ins Herz u. Ohr, Du weißt ja, daß ich nichts mehr will damit zu thun haben,",negative
38,Sie hat sich auch gesund geglaubt.,positive
26,"dann fuhren wir weiter und kamen mit Tagesausbruch vor Gnadenhütten an, wo noch untersucht wurde, ob wir nicht etwa silberne Schuhschnallen oder sonst etwas bei uns hätten; sie fanden aber nichts.",neutral
36,"Eines hat mich durchgebracht, Lämmlein /// daß Du bist geschlacht’t.",neutral
35,"1759 den 9ten December wurde ich in die Gemeine aufgenommen,",neutral
19,"Er thats und zeigte mir alles so klar, was ich von meiner Kindheit auf begangen hatte, daß ich vor Wehmuth meines Herzens nichts thun konnte als um Vergebung meiner Sünden zu Gott weinen und schreyen.",negative
5,"Wiewol es die verächtlichsten Beschreibungen waren, die man mir von der Gemeine machte; so glaubte ich immer das Gegentheil und fühlte gar zu gut daß dieses mein Volck wäre, mit dem ich leben und sterben wollte, ob ich gleich noch nie keinen Bruder oder Schwester gesehen hatte, und mein einziger Kummer war nur der: wie wird das möglich seyn dahin zu gelangen?",positive
9,"Ich muß mich zu Hause halten und da kan ich die Schule und Versamlungen besorgen, wenn ich wohl bin.",negative
24,"sonderl. ging er die 3. lezter Jahre ss. hierseyns einen hübschen sünder-haft seln. Gnaden=Gang, war ^erkenntlich u. dankbar vor alles, was er in d. gemein genoß treu u. gehorsam in dem Anbefohlene, danckte oft mit Thränen dem heilde vor sn gnaden=Loos, bey sm Volcke und ein Glied der Gemeine zu seyn; u. bey dem zu bleiben, war sein größtes Verlangen.",positive
38,[Das folgende Jahr wurde ich in die Gemeine aufgenommen und kam auch zum heiligen Abendmahl.,neutral
14,Er selbst schrieb davon:,neutral
27,"Da er denn so vom Heiland Verdienst und Leiden zeigte, daß mir mein Herz in tausend Tränen zerfloß.",positive
23,"Da mich Pfarrer {NAME} sah, fragte er: was ich für ein Landsmann sey,",neutral
34,"Ruhe sanft du liebes Herze, nach so mancher Angst und Schmerze In des Bräutgams Blut und Wunden, drinnen du dein Heil gefunden Bey den durch gebohrten Füßen, wirst du ewiglich genießen unaussprechlich süße Weide, ewge Wonne, Fried u. Freude.",positive
32,"Uns war Sie lieb u. werth, Ihm aber zu theuer, Sie uns noch länger zu laßen.",positive
5,"Am 19ten Juni da sie sich des Heimgangs-Tags der lieben seligen Mama viel erinnert hatte, ermunterte sie sich Abends noch aus ihrer großen Schwachheit und hielt die gewöhnliche Conferenz der Vorgesezten, in welcher sie eine uns sehr eindrücklichen und sünderhaften Abschied machte; die Schaufruffe den Heiland mit ihr zu danken und sich mit ihr zu freuen über ihr großes Glück.",positive
10,"über 16. Jahr war ein treuer und lieber Nachtwächter, der manches schlaflose mit seinem lieblichen Gesang erfreute.",positive
3,"weils mir aber auch da nicht recht war und auch meine Eltern etwas ausserordentliches bey mir merkten; so bat ich sie, mich über Feld zu schicken, damit ich alleine seyn könnte.",negative
34,"1761. hatte ich die Gnade ins Stunden Gebeth zu kommen, welches mir zum Seegen war.",positive
28,Um diese Zeit kamen die ersten Brüder nach Nyork u. logirten bey Mr. {NAME}.,neutral
26,"In diesen bangen Stunden ließ mich der liebe Heiland besonders Seine liebe Nähe fühlen,",positive
36,"{Vorher hatten wir i} In Westmünster hatten wir ein Chorabendmahl, welches der sel. Jünger hielt, {und} die Jüngerin segnete uns mit Handauflegnung dazu ein.",neutral
23,"einer derselben redte mich einmal an und sagte: er sehe daß ich sehr fleißig zur Kirche komme, das sey aber nicht genug, ich solte auch suchen mich auf Jesu blutiges Verdienst zu gründen, welches in meinem Herzen einen gesegneten Eindruck machte.",negative
38,Sie war 1725 den 26tn Sept. zu Sachenburg in der Grafschaft Sayn im Westpfälischen Kreise gebohren.,neutral
34,"Mein Vater hatte den Heiland lieb, und legte oft alle seine Kinder mit Gebeth und Tränen an sein Herz.",positive
14,Zum 30ten Merz. 1782. Unser seliger Bruder {NAME} hat folgendes von seinem Lebens-Laufe selbst auf geschrieben:,neutral
26,Wir nahmen dieses Anerbieten mit Dank an und setzten sodann unsre Reise fort.,positive
5,"Das war wol ein unaussprechliches Seufzen, das der Heilige Geist selbst in mir that.",neutral
33,ihre Kranckheit mit einer starken geschwulst an den Beinen nahm von Tag zu Tag zu bis entlich auch daß starcke Gallen brechen dazu kam,negative
27,"Im folgenden Jahr kamen wir in die Wirtschaft nach Gnadental und Anno 1752 nach Friedenstal, wo wir einen zwar kurzen aber vergnügten Aufenthalt hatten.",positive
38,"Sie hatte keine Freudigkeit ihren Mann zu Anfang dieses Jahres mit auf den Synodum nach teutschland zu begleiten, wozu sie doch mit eingeladen war, weil sie ihrer Kränklichkeit wegen auf See- Reisen glaubte, daß sie ihm mehr zur Beschwerde als Erleichterung seyn werde, entließ aber ihren lieben Mann mit einem kindlich ergebnen Herzen.",negative
3,"Ich ging meinen seligen Gang fort und kann zum Preise des Heilands und zu meiner Beschämung sagen, daß ich in meinen Knabenjahren keine Stunden confus war;",negative
32,"Wenn ich es wo versehen hatte, konte ich nicht eher ruhen u. mich zufrieden geben, bis ich vom Hld. u. meinen Vorgesezten völlige Vergebung darüber bekam.",negative
33,"ich dancke dem lieben Heiland für alles was Er an mir als Seiner Elenden durch meine ganze lebens Zeit gethan hat,",positive
14,"Er blieb aber allemal ihr wahrer Freund, und diente wo er konnte, mit Freuden.",positive
27,"Meine Eltern {NAME} und {NAME}, die Mutter eine geborene {NAME}, waren gottsuchende, um ihre Seligkeit bekümmerte Leute, hielten mich fleißig zur Kirche, sonderlich zur Lesung der Bibel an , wozu ich sonderinklinierte von Jugend auf. Ward auch unruhig von Kindesbeinen an; und sonderlich da ich das erste Mal zum Abendmahl ging.",positive
33,sie wurde getröstet und der liebe Heiland bekante sich wieder aufs neue zu ihr.,positive
32,"Treue, Pünktlichkeit Waren allezeit Deine Zierde hie.",positive
19,man muss sich Ihn aber recht ansehn und wenn wir uns einander was von diesem Mann erzehlen. so werden meine Augen naß und in einer Weile drauf sagte er: Ach wie wohl ist mir doch!,positive
11,"In der 5 Nacht früh um 1 Uhr reiste ich ab, und kam glücklich in mein Vaterland, ging daselbst meinem Handwerck wieder nach, arbeitete aber nur 1 Jahr.",positive
33,"da ich zurück kam sagten sie mir ich müste einen Indianer nehmen und ihn heuratten,",negative
25,"Sie hatte dieselben und ihren Mann zärtlich lieb, und ob sie gleich, nachdem sie aus der Beckerey abgelöst wurden, viel schweres mit zu ertragen hatte, dabey auch ihre Gesundheit litte, indem sie sich nicht immer bald drein finden konte; so schenckte ihr doch der Heiland die Gnade, daß sie sich in ihre Armuth und Dürftigkeit schickte und bey aller ihrer Schwäche durch Arbeit und Fleiß das durchkommen ihrer Familie zu erleichtern bemüht war.",positive
1,"Sie wurde Anno 60 den 19. Januar Candidatin zum Abendmahl, welches ihrem Herzen einen besondern Eindruck gab, und von da an hatte Sie eine aparte gnaden Zeit lernte sich mehr kennen, und kam mit ihrem Herzen in eine wahre bekantschaftt mit dem Heiland,",positive
26,"Wir kamen just zu einem Gemeintag dahin, und baten um die Aufnahme in die Gemeine, die uns auch zu unserer Beschämung im August 1742 zuteil wurde.",positive
23,von da wolte 1744 mit meinem leiblichen Bruder nach Hause reisen wir konnten aber wegen den österreichischen Werbern nicht durchkommen,negative
38,"[Zwey ihrer Kinder, nämlich ein Sohn {NAME} und eine Tochter {NAME} sind in Carolina gebohren.",neutral
19,wir wurden draüber gelästert und ich gerieth in große Confusion.,negative
2,Am Ostermontag 1748 wurde sie in die Gemeine aufgenommen und im November drauf gelangte sie zum Heilgen Abendmahl.,neutral
36,"Jezt halte ich meinen Sabbath, und dancke dem Heiland, daß ich in meinem Chorhause bin.",positive
5,"Sie war aber eine Elende des Herrn, die keinen Gefallen an sich selber hatte und nichts von Lob und Ehre bey Menschen wißen wollte, sondern ihre größte Seligkeit in der Niedrigkeit des Herzens und wahren Geistes Armuth fand, und alles für unverdiente Gnade achtete.",negative
8,"Nachmittag aber benahm ihm ein starkes Erbrechen auf einmal so die Kräfte, daß er sich legen muste musste, u. sehr über Leibes-Schmerzen klagte, wobei er aber sehr still lag, u. viel mit seinem Herrn allein redte.",negative
36,"Einmal da ich mich recht lustig machte, fühlte ich eine solche Unruhe und Verlegenheit, daß ich ganz laut weinte, und auf meinen Knien im Felde zu Gott betete, daß Er sich meiner wieder erbarmen möchte, weil ich sahe daß mein Herz von Ihm abgekommen.",negative
14,"Nach dieser Reise nahm unser seliger Bruder einen Antrag des seligen Grafen, ein Paquet Briefschaften selbst nach Europa zu überbringen, willig an, reiste den 4ten August dieses Jahres von Bethlehem über Philadelphia, und weil da keine Schifs-Gelegenheit vorhanden, über Newyork nach London ab, wo er den 23ten October ankam.",positive
5,"Dieses geschahe dann vor dem Grün-Donnerstag Herz vielen Thränen und in der innigsten Gegenwart des Heilands; wovon sie nachher bezeugte, daß Er ihr darauf ein rechtes Sünder Siegel aufgedrückt habe.",negative
20,"in Corzem weil nun schon ville meiner bekanden ausgegangen und in Herrnhut wohnden under andern auch unser Seliger Bruder {NAME} seine Frau unsser lieben {NAME} ihre Mutter die eine der das inntesten Freundin von mir ward, konte ia nicht ruhen ohne mich errettet zu sehen,",positive
36,"Was der Hld. an. mir Seinem armen Creatürlein gethan hat, das bleibt zwischen Ihm und mir, und ich werde Ihm davor dancken, wenn ich einmal die Gnade haben werde Ihn zu sehen, und ewig bey Ihm zu seyn.",positive
10,Ao 1773. den 14ten October bin ich geboren im Dorf Burgenwald in der Grafschaft Jagerndorff in Ober Schlesien.,neutral
5,"Ihre freundlichen Blicke bezeugten noch immer den Umstehenden ihre zärtliche Liebe, bey alle dem daß Ihr Leiden schmerzlich schien.",positive
35,"1779 den 28ten Sept. wurde ich mit dem led. Br. {NAME} in Nazareth zur h. Ehe verbunden,",neutral
14,"Hier beschloß ich so lange bei meinen Eltern zu bleiben, als sie leben würden, welches ich auch bis zu meiner Mutter Tode, der im May 1736 erfolgte, gethan habe.",neutral
7,"1773. erhielt ich einen Ruf nach Amerika, wurde den 14ten Juni in Barby zum Diacono ordinirt, und kam den 24. September nebst noch 5 Brüdern in Bethlehem an.",neutral
33,"daß war eine große freude für mich,",positive
33,"o! wie froh und danckbar war ich wieder Geschwister zu sehn,",positive
6,"So ruhe nun in Jesu Schooß O Seliger, dein Glück ist wahrlich groß, In jener Zahl Vollendeten zu stehn, Wo's ewig tönt: Wir sind durchs Blut versöhnt.",positive
32,der Gemein Gnaden würde Er gewiß zur rechten Zeit mich theilhaftig machen;,positive
23,"da er wieder zu sich kam, fragte er: {NAME} was denkt ihr: wo wäre ich hin kommen",neutral
0,"und wiewol er über sein Elend u. Zurückbleiben in der Liebe zum Heiland oft betrübt u. verlegen war, so war doch sein erbaulicher u. exemplarischer Wandel ein redender Beweiß, daß sein Herz im Heiland lebte;",negative
8,"Gegen Abend ließ er sich noch auf den Stuhl sezen setzen, aber auch bald wieder ins Bette bringen.",neutral
26,"1769 erhielten wir wieder einen Ruf unter die Indianer und zwar nach Wihilusing an der Susquehanna, den wir im GeBühl unserer Dürftigkeit, und auf den Beistand und die Durchhilfe des lieben Heilands vertrauend, annahmen.",positive
9,"weil es sich aber zu meiner Profession nicht wol schicken wolte, so resolvirte ich, meine nunmehr selige Frau {NAME} gebohrne {NAME} zu heyrathen, von der ich die Hofnung hatte, daß sie sich auch bekehren würde.",neutral
26,"An Beschäftigung fehlte es mir nicht, ich griff überall zu, wo ich hingestellt wurde, besonders half ich dem Br. {NAME} beim Anbau am jetztigen Gemeinhause.",positive
26,ich achtete es anfangs nicht;,neutral
36,"Den Tag und dieses Abendmahl werde ich in meinem Leben nicht vergeßen, was mein Herz dabey gefühlt und genoßen hat.",positive
38,"Da sich aber doch ein kleiner eigenhändiger Aufsatz der seligen Schwester von ihren Lebensumständen gefunden: so könnenommen wir doch nicht umhin, auf eine obgleich unvollkommene Weise {etwas davon} einige ihrer Lebens Umstände zu erwähnen.",negative
26,Am 24ten August wurde ich durch Br. {NAME} mit der verwittweten Schwester {NAME}in geb. {NAME} getraut.,neutral
